{
  "base_commit": "7c1360b338eb154f6f9526648246b4a472723c34",
  "branch": "fix/production-rescan-precommissioning",
  "changed_paths": [
    ".github/workflows/production-vulnerability-rescan.yml",
    "scripts/production/tests/test_verify.py",
    "scripts/production/verify.py"
  ],
  "checkpoint_id": "20260822T154103Z-make-the-scheduled-production-deployed-digest-vulnerability-resc",
  "completed": [
    "Diagnosed scheduled GitHub Actions run 32548286268: it failed before any production inventory existed because the registry credential step ran before the no-inventory branch.",
    "Changed the rescan workflow to detect tracked production inventory before downloading release tools or requiring registry credentials.",
    "Preserved fail-closed registry credential, fresh Grype database, High/Critical blocking, and retained evidence behavior when production inventory exists.",
    "Added repository verification that protects inventory-first ordering, no-inventory evidence, literal newline formatting, and conditional tool/credential/scan execution."
  ],
  "decisions": [
    {
      "authority_refs": [
        "infrastructure/production/README.md",
        "deploy/releases/production/README.md",
        "docs/architecture/implementation-status.md"
      ],
      "summary": "Pre-commissioning no-inventory state is explicit evidence, not a production scanning success claim; release tooling and registry credentials are only required after tracked production inventory exists."
    },
    {
      "authority_refs": [
        "docs/adr/0035-automate-sbom-vulnerability-response-and-deployment-gates-v1.md",
        "docs/adr/0038-harden-vulnerability-exceptions-threat-intelligence-and-ownership-v1.md",
        "docs/adr/0045-standardize-devsecops-scanning-and-artifact-security-v1.md"
      ],
      "summary": "Once production inventory exists, the rescan remains fail closed and does not weaken Grype severity, data freshness, credential, or evidence-retention requirements."
    }
  ],
  "next_actions": [
    "Regenerate FILE_INDEX, verify Context and repository baseline, commit/push this work checkpoint.",
    "Complete protected PR #96 review/merge lifecycle and verify the merged no-inventory workflow path.",
    "Create and merge the non-recursive post-merge checkpoint follow-up."
  ],
  "objective": "Make the scheduled production deployed-digest vulnerability rescan safe and explicit before production inventory is commissioned.",
  "project_id": "hooshix",
  "pull_request": 96,
  "recorded_at_utc": "2026-08-22T15:41:03Z",
  "repository": "hasanjodatshandi/HooshiX",
  "risks": [
    "This fix intentionally does not create or imply production inventory, registry credentials, or production readiness.",
    "Real production commissioning remains dependent on external environment inputs and ADR-0030 compliant production operator access."
  ],
  "schema_version": 1,
  "scope": {
    "bounded_contexts": [],
    "review_mode": "full-read",
    "routes": [
      "production-infrastructure",
      "devsecops-release"
    ]
  },
  "subject_commit": "05728c589523b88a75cc7f99ad4cef4b5b17236c",
  "unfinished": [
    "Pass protected PR #96 CI and merge the defect fix.",
    "Dispatch the merged scheduled rescan workflow on main and verify the no-production-inventory artifact path succeeds without registry credentials.",
    "Publish the required post-merge checkpoint-only follow-up for PR #96."
  ],
  "verification": {
    "failed": [],
    "not_run": [
      {
        "check": "Protected PR #96 CI",
        "evidence": "Not run yet on the checkpointed final PR head."
      },
      {
        "check": "Post-merge workflow_dispatch no-inventory execution",
        "evidence": "Not run until the fix merges to protected main."
      },
      {
        "check": "Real production commissioning",
        "evidence": "Not run; no production release manifest, production Kubernetes context, GitHub production-release environment, registry credentials, or external commissioning evidence is currently provisioned."
      }
    ],
    "passed": [
      {
        "check": "Inventory detection simulation",
        "evidence": "Both empty-inventory and inventory-present branches executed locally; empty emitted no-production-inventory evidence and present emitted present=true without false no-inventory evidence."
      },
      {
        "check": "Production tests",
        "evidence": "python3 -m unittest discover -s scripts/production/tests -p test_*.py passed 27 tests."
      },
      {
        "check": "Production contract verification",
        "evidence": "python3 scripts/production/verify.py passed."
      },
      {
        "check": "Workflow shell syntax",
        "evidence": "All four GitHub Actions bash run blocks passed bash -n."
      },
      {
        "check": "Repository baseline",
        "evidence": "make baseline-verify passed with 819 indexed files, 51 ADRs, and 27 dependency edges before checkpoint creation."
      },
      {
        "check": "Secret scan",
        "evidence": "Pinned redacted Gitleaks current-tree scan found no leaks; ignored local runtime/build paths produced permission warnings but no tracked change was skipped by Git diff review."
      },
      {
        "check": "Diff integrity",
        "evidence": "git diff --check and complete three-file implementation diff review passed."
      }
    ]
  }
}
