{
  "base_commit": "da8a7e6e364dee8f14e1555d39f1e9d9aa545437",
  "branch": "docs/reconcile-production-conformance-status",
  "changed_paths": [
    "docs/architecture/PRODUCTION-ARCHITECTURE-REVIEW.md",
    "docs/architecture/PRODUCTION-DECISION-SUMMARY.md",
    "docs/architecture/implementation-status.md"
  ],
  "checkpoint_id": "20260822T142409Z-reconcile-current-production-infrastructure-conformance-status-d",
  "completed": [
    "Completed the mandatory post-task full documentation review on merged main and found stale current-state claims about Syft, Grype, Cosign, and Kyverno implementation status.",
    "Updated the Production Architecture Review and Production Decision Summary review date to 2026-08-22 and reconciled their current-state implementation wording.",
    "Updated implementation-status evidence boundaries so repository release/admission controls are recorded as implemented while real production execution and enforcement remain NOT VERIFIED.",
    "Preserved historical ADR text and avoided any claim that production runtime, registry signing/scanning, deployed-digest rescanning, or production-cluster admission has executed."
  ],
  "decisions": [
    {
      "authority_refs": [
        "docs/architecture/implementation-status.md",
        "docs/architecture/devsecops-security-toolchain.md"
      ],
      "summary": "Current-state documentation must distinguish repository implementation from production execution evidence; repository Syft/Grype/Cosign workflows and stable Kyverno release-policy generation are implemented, while real production execution remains NOT VERIFIED."
    },
    {
      "authority_refs": [
        "docs/adr/0045-standardize-devsecops-scanning-and-artifact-security-v1.md",
        "docs/engineering/documentation-standards.md"
      ],
      "summary": "Historical ADR wording remains unchanged because this correction reconciles current-state summaries rather than rewriting decision history."
    }
  ],
  "next_actions": [
    "Regenerate FILE_INDEX, verify Context and repository baseline, and commit the work checkpoint.",
    "Push the branch, open a focused Draft PR, require protected CI success, then merge through branch protection.",
    "Verify exact merged main and complete the required post-merge checkpoint-only follow-up PR."
  ],
  "objective": "Reconcile current Production Infrastructure conformance status documentation after PR #92 so repository implementation is not confused with real production execution evidence.",
  "project_id": "hooshix",
  "recorded_at_utc": "2026-08-22T14:24:09Z",
  "repository": "hasanjodatshandi/HooshiX",
  "risks": [
    "Production runtime/readiness remains outside this documentation correction and must not be inferred from repository implementation status.",
    "The work checkpoint records implementation commit c0e8157f0a1dd8b87ae3684c1133da2259d2c7f4; protected PR CI and merge evidence occur after this checkpoint."
  ],
  "schema_version": 1,
  "scope": {
    "bounded_contexts": [],
    "review_mode": "full-read",
    "routes": [
      "documentation-governance",
      "production-infrastructure",
      "devsecops-release"
    ]
  },
  "subject_commit": "c0e8157f0a1dd8b87ae3684c1133da2259d2c7f4",
  "unfinished": [
    "Commit this work checkpoint, publish the focused documentation PR, pass protected CI, merge it, verify merged main, and publish the required non-recursive post-merge checkpoint follow-up."
  ],
  "verification": {
    "failed": [],
    "not_run": [
      {
        "check": "Real production release/admission execution",
        "evidence": "Not run and not claimed. The documentation correction explicitly preserves this as NOT VERIFIED."
      },
      {
        "check": "Protected GitHub Actions on the final documentation PR head",
        "evidence": "Not run yet because the work checkpoint must be committed and pushed before protected CI."
      }
    ],
    "passed": [
      {
        "check": "Complete repository baseline",
        "evidence": "make baseline-verify passed on implementation commit c0e8157f0a1dd8b87ae3684c1133da2259d2c7f4 with repository verification reporting 816 indexed files, 51 ADRs, and 27 dependency edges."
      },
      {
        "check": "Stale current-state claim search",
        "evidence": "Targeted grep found no remaining current-state claim that the Syft/Grype/Cosign release automation or Kyverno production release-admission generation is NOT PRESENT or not implemented."
      },
      {
        "check": "Whitespace integrity",
        "evidence": "git diff --check passed for the three-file documentation reconciliation."
      },
      {
        "check": "Secret scan",
        "evidence": "Pinned redacted Gitleaks current-tree scan reported no leaks in the documentation reconciliation worktree."
      }
    ]
  }
}
