{
  "base_commit": "68cf66cf24c07dd6fca010ddae2789f42608aa31",
  "branch": "docs/engineering-hardening-roadmap",
  "changed_paths": [
    "FILE_INDEX.txt",
    "context/bootstrap.json",
    "context/routes.json",
    "docs/architecture/APPLICATION-IMPLEMENTATION-ROADMAP.md",
    "docs/architecture/ENGINEERING-HARDENING-ROADMAP.md",
    "docs/architecture/PRODUCTION-ARCHITECTURE-REVIEW.md",
    "docs/architecture/PRODUCTION-DECISION-SUMMARY.md",
    "docs/architecture/README.md",
    "docs/architecture/SOURCES.md",
    "docs/architecture/TASK-REVIEW-MATRIX.md",
    "docs/architecture/devsecops-security-toolchain.md",
    "docs/architecture/implementation-status.md",
    "docs/engineering/agent-communication-and-reporting.md"
  ],
  "checkpoint_id": "20260828T221510Z-document-the-repository-wide-engineering-audit-and-complete-hard",
  "completed": [
    "Published the engineering hardening finding register, ordered stages, completion gates, and interruption-safe status protocol.",
    "Connected the hardening roadmap to architecture sources, application sequencing, bootstrap authority, and generated task review routing.",
    "Reconciled frontend milestone scope, Identity implementation wording, protected CI evidence, Production summaries, and stale AGENTS section references.",
    "Reviewed the complete documentation and governance diff against unchanged origin/main.",
    "Marked Stage 1 completed only after local and protected verification passed; Stage 2 is the next stage."
  ],
  "decisions": [
    {
      "authority_refs": [
        "docs/architecture/APPLICATION-IMPLEMENTATION-ROADMAP.md",
        "docs/architecture/ENGINEERING-HARDENING-ROADMAP.md"
      ],
      "summary": "The audit remediation track is a mandatory prerequisite before ADR-0054 Conversation implementation."
    },
    {
      "authority_refs": [
        "AGENTS.md",
        "docs/engineering/repository-change-workflow.md",
        "docs/architecture/ENGINEERING-HARDENING-ROADMAP.md"
      ],
      "summary": "Stage state is repository-authoritative and completed only after full stage diff review and applicable executable gates pass."
    }
  ],
  "next_actions": [
    "Push the Stage 1 completion state and generated work checkpoint to PR #119.",
    "Wait for final protected checks, review the final PR diff, merge, and verify main.",
    "Create and merge the checkpoint-only post-merge receipt, then start Stage 2."
  ],
  "objective": "Document the repository-wide engineering audit and complete hardening Stage 1 current-truth reconciliation.",
  "project_id": "hooshix",
  "pull_request": 119,
  "recorded_at_utc": "2026-08-28T22:15:10Z",
  "repository": "hasanjodatshandi/HooshiX",
  "risks": [
    "Production commissioning and environment-dependent evidence remain deferred or NOT VERIFIED and are not Stage 1 completion claims."
  ],
  "schema_version": 1,
  "scope": {
    "bounded_contexts": [],
    "review_mode": "full-read",
    "routes": [
      "documentation-governance",
      "agent-context-engine",
      "production-readiness"
    ]
  },
  "subject_commit": "d3425352b92ef68bc635888f7722da02cb393464",
  "unfinished": [
    "Publish the work checkpoint, pass final protected PR checks, merge PR #119, verify main, and publish the required post-merge checkpoint receipt.",
    "Begin Engineering Hardening Stage 2 only after Stage 1 merge and checkpoint lifecycle complete."
  ],
  "verification": {
    "failed": [],
    "not_run": [
      {
        "check": "Final PR checks after the completion-state/checkpoint commits",
        "evidence": "Pending final PR #119 head push."
      }
    ],
    "passed": [
      {
        "check": "Context and repository baseline",
        "evidence": "make context-verify, generated TASK-REVIEW-MATRIX parity, make context-bootstrap, and make baseline-verify passed locally on the Stage 1 completion state."
      },
      {
        "check": "Protected repository baseline",
        "evidence": "Run 33162134425 passed contracts, all five Java service security suites, repository structure, and final aggregator on reviewed implementation head e33fff3f707d40a250044a38e05649977acedbc5."
      },
      {
        "check": "Protected frontend E2E",
        "evidence": "Run 33162134277 passed npm ci, API drift, build, and all Playwright journeys on reviewed implementation head e33fff3f707d40a250044a38e05649977acedbc5."
      },
      {
        "check": "Complete diff review",
        "evidence": "Reviewed base 68cf66cf24c07dd6fca010ddae2789f42608aa31 through Stage 1 completion commit d342535; no remaining Stage 1 finding."
      }
    ]
  }
}
